{
  "schema_version": 1,
  "id": "ciqual-20831",
  "kind": "generic",
  "names": {
    "fr": "Patate douce, pulpe, blanchie, surgelée, prélevée à la Martinique",
    "en": "Sweet potato, pulp, blanched, frozen, sampled in the island of La Martinique"
  },
  "scientific_name": null,
  "category_ids": [
    "ciqual-02",
    "ciqual-0201",
    "ciqual-020104"
  ],
  "source": {
    "dataset_id": "anses-ciqual-2025",
    "food_code": "20831"
  },
  "nitrogen_to_protein_factor": 6.25,
  "nutrition_profiles": [
    {
      "id": "ciqual-2025",
      "basis": {
        "amount": 100,
        "unit": "g",
        "portion": "edible"
      },
      "nutrients": {
        "ciqual-327": {
          "value": null,
          "qualifier": "missing",
          "source_value": "-"
        },
        "ciqual-328": {
          "value": null,
          "qualifier": "missing",
          "source_value": "-"
        },
        "ciqual-332": {
          "value": null,
          "qualifier": "missing",
          "source_value": "-"
        },
        "ciqual-333": {
          "value": null,
          "qualifier": "missing",
          "source_value": "-"
        },
        "ciqual-400": {
          "value": 63.1,
          "qualifier": "reported",
          "source_value": "63,1",
          "confidence_code": "A",
          "source_ref": "396"
        },
        "ciqual-10000": {
          "value": null,
          "qualifier": "missing",
          "source_value": "-"
        },
        "ciqual-10004": {
          "value": null,
          "qualifier": "missing",
          "source_value": "-"
        },
        "ciqual-10110": {
          "value": null,
          "qualifier": "missing",
          "source_value": "-"
        },
        "ciqual-10120": {
          "value": null,
          "qualifier": "missing",
          "source_value": "-"
        },
        "ciqual-10150": {
          "value": null,
          "qualifier": "missing",
          "source_value": "-"
        },
        "ciqual-10170": {
          "value": null,
          "qualifier": "missing",
          "source_value": "-"
        },
        "ciqual-10190": {
          "value": null,
          "qualifier": "missing",
          "source_value": "-"
        },
        "ciqual-10200": {
          "value": null,
          "qualifier": "missing",
          "source_value": "-"
        },
        "ciqual-10251": {
          "value": null,
          "qualifier": "missing",
          "source_value": "-"
        },
        "ciqual-10260": {
          "value": null,
          "qualifier": "missing",
          "source_value": "-"
        },
        "ciqual-10290": {
          "value": null,
          "qualifier": "missing",
          "source_value": "-"
        },
        "ciqual-10300": {
          "value": null,
          "qualifier": "missing",
          "source_value": "-"
        },
        "ciqual-10340": {
          "value": null,
          "qualifier": "missing",
          "source_value": "-"
        },
        "ciqual-10530": {
          "value": null,
          "qualifier": "missing",
          "source_value": "-"
        },
        "ciqual-25000": {
          "value": null,
          "qualifier": "missing",
          "source_value": "-"
        },
        "ciqual-25003": {
          "value": null,
          "qualifier": "missing",
          "source_value": "-"
        },
        "ciqual-31000": {
          "value": null,
          "qualifier": "missing",
          "source_value": "-"
        },
        "ciqual-32000": {
          "value": null,
          "qualifier": "missing",
          "source_value": "-"
        },
        "ciqual-32210": {
          "value": null,
          "qualifier": "missing",
          "source_value": "-"
        },
        "ciqual-32220": {
          "value": null,
          "qualifier": "missing",
          "source_value": "-"
        },
        "ciqual-32250": {
          "value": null,
          "qualifier": "missing",
          "source_value": "-"
        },
        "ciqual-32410": {
          "value": null,
          "qualifier": "missing",
          "source_value": "-"
        },
        "ciqual-32430": {
          "value": null,
          "qualifier": "missing",
          "source_value": "-"
        },
        "ciqual-32480": {
          "value": null,
          "qualifier": "missing",
          "source_value": "-"
        },
        "ciqual-33110": {
          "value": 19.3,
          "qualifier": "reported",
          "source_value": "19,3",
          "confidence_code": "A",
          "source_ref": "396"
        },
        "ciqual-34000": {
          "value": 0,
          "qualifier": "reported",
          "source_value": "0",
          "confidence_code": "B",
          "source_ref": "444"
        },
        "ciqual-34100": {
          "value": 4.9,
          "qualifier": "reported",
          "source_value": "4,9",
          "confidence_code": "A",
          "source_ref": "396"
        },
        "ciqual-40000": {
          "value": null,
          "qualifier": "missing",
          "source_value": "-"
        },
        "ciqual-40302": {
          "value": null,
          "qualifier": "missing",
          "source_value": "-"
        },
        "ciqual-40303": {
          "value": null,
          "qualifier": "missing",
          "source_value": "-"
        },
        "ciqual-40304": {
          "value": null,
          "qualifier": "missing",
          "source_value": "-"
        },
        "ciqual-40400": {
          "value": 0,
          "qualifier": "reported",
          "source_value": "0",
          "confidence_code": "B",
          "source_ref": "444"
        },
        "ciqual-40600": {
          "value": 0,
          "qualifier": "reported",
          "source_value": "0",
          "confidence_code": "B",
          "source_ref": "444"
        },
        "ciqual-40800": {
          "value": 0,
          "qualifier": "reported",
          "source_value": "0",
          "confidence_code": "B",
          "source_ref": "444"
        },
        "ciqual-41000": {
          "value": null,
          "qualifier": "missing",
          "source_value": "-"
        },
        "ciqual-41200": {
          "value": null,
          "qualifier": "missing",
          "source_value": "-"
        },
        "ciqual-41400": {
          "value": null,
          "qualifier": "missing",
          "source_value": "-"
        },
        "ciqual-41600": {
          "value": null,
          "qualifier": "missing",
          "source_value": "-"
        },
        "ciqual-41800": {
          "value": null,
          "qualifier": "missing",
          "source_value": "-"
        },
        "ciqual-41819": {
          "value": null,
          "qualifier": "missing",
          "source_value": "-"
        },
        "ciqual-41826": {
          "value": null,
          "qualifier": "missing",
          "source_value": "-"
        },
        "ciqual-41833": {
          "value": null,
          "qualifier": "missing",
          "source_value": "-"
        },
        "ciqual-42046": {
          "value": null,
          "qualifier": "missing",
          "source_value": "-"
        },
        "ciqual-42053": {
          "value": 0,
          "qualifier": "reported",
          "source_value": "0",
          "confidence_code": "B",
          "source_ref": "444"
        },
        "ciqual-42263": {
          "value": 0,
          "qualifier": "reported",
          "source_value": "0",
          "confidence_code": "B",
          "source_ref": "444"
        },
        "ciqual-51104": {
          "value": 10.8,
          "qualifier": "reported",
          "source_value": "10,8",
          "confidence_code": "A",
          "source_ref": "444"
        },
        "ciqual-51200": {
          "value": 0,
          "qualifier": "reported",
          "source_value": "0",
          "confidence_code": "B",
          "source_ref": "444"
        },
        "ciqual-51330": {
          "value": 130,
          "qualifier": "reported",
          "source_value": "130",
          "confidence_code": "A",
          "source_ref": "396"
        },
        "ciqual-52100": {
          "value": null,
          "qualifier": "missing",
          "source_value": "-"
        },
        "ciqual-52200": {
          "value": null,
          "qualifier": "missing",
          "source_value": "-"
        },
        "ciqual-52300": {
          "value": 0,
          "qualifier": "reported",
          "source_value": "0",
          "confidence_code": "B",
          "source_ref": "444"
        },
        "ciqual-53100": {
          "value": null,
          "qualifier": "missing",
          "source_value": "-"
        },
        "ciqual-54101": {
          "value": null,
          "qualifier": "missing",
          "source_value": "-"
        },
        "ciqual-54104": {
          "value": null,
          "qualifier": "missing",
          "source_value": "-"
        },
        "ciqual-55100": {
          "value": 4,
          "qualifier": "reported",
          "source_value": "4",
          "confidence_code": "A",
          "source_ref": "396"
        },
        "ciqual-56100": {
          "value": null,
          "qualifier": "missing",
          "source_value": "-"
        },
        "ciqual-56200": {
          "value": null,
          "qualifier": "missing",
          "source_value": "-"
        },
        "ciqual-56310": {
          "value": null,
          "qualifier": "missing",
          "source_value": "-"
        },
        "ciqual-56400": {
          "value": null,
          "qualifier": "missing",
          "source_value": "-"
        },
        "ciqual-56500": {
          "value": null,
          "qualifier": "missing",
          "source_value": "-"
        },
        "ciqual-56600": {
          "value": null,
          "qualifier": "missing",
          "source_value": "-"
        },
        "ciqual-56700": {
          "value": null,
          "qualifier": "missing",
          "source_value": "-"